{
  "$schema": "./device.schema.json",
  "id": "apple-iphone-18-pro",
  "name": "iPhone 18 Pro",
  "brand": "Apple",
  "category": "phone",
  "year": 2026,
  "resolution": {
    "width": 1206,
    "height": 2622
  },
  "source": "https://www.macworld.com/article/228816/best-iphone-pro-max-duo-ranked.html"
}
